{
  "alignment_sha256": "eba0cbb6b7445a2b1af232a36ca51f56778d0ef673b90160dd48ae3397a13eea",
  "contract_version": "nt-greek-verse-v18",
  "notes": [
    "Independent review — unchanged",
    "JHN.6.33 verified correct as accepted — partition complete, `τοῦ` (s004, s010) rightly `unrepresented` with *of* on the noun, and the `ὁ … καταβαίνων` split (*that* / *which cometh down*) conforms to rule 32."
  ],
  "ref": "JHN.6.33",
  "reviewed_by": "claude-code",
  "status": "reviewed"
}
