{
  "alignment_sha256": "2da081731966416bf5613926d76148192f94907bc8669b001f08bc5a087a8000",
  "contract_version": "ot-hebrew-verse-v126",
  "notes": [
    "Independent review by gpt-6-astra (codex-astra) — unchanged"
  ],
  "ref": "SNG.4.13",
  "reviewed_by": "gpt-6-astra (codex-astra)",
  "status": "reviewed"
}
