{
  "alignment_sha256": "b6f1ece3a916325369a28010376f63251361985c0e88538ad8f4eae58a590ee2",
  "contract_version": "ot-hebrew-verse-v45",
  "notes": [
    "Reconciled the presentative apodosis and split source-less lexical subject one as added; verse validated."
  ],
  "ref": "GEN.38.28",
  "status": "reviewed"
}
