{
  "alignment_sha256": "069f520f8d4d2297f1b668124eb689d5a39bcb3e7463bf6a94dfd31458339620",
  "contract_version": "ot-hebrew-verse-v129",
  "notes": [
    "Independent review by claude-code — unchanged",
    "even unto is read as the lamed's own expanded limit rendering under rule 16 rather than as an appositional even; no object marker stands on that phrase.",
    "ki im is fused as But under rule 35 and headed on the governing particle under rule 23."
  ],
  "ref": "DEU.12.5",
  "reviewed_by": "claude-code",
  "status": "reviewed"
}
