{
  "alignment_sha256": "dcd86e309a65962dec54b10b1e21a1aba7c11f8f16422a3847fe6b4b2c0f33fc",
  "contract_version": "ot-hebrew-verse-v42",
  "notes": [
    "Independent review by gpt-5.6-sol (codex) — corrected"
  ],
  "ref": "NUM.31.37",
  "reviewed_by": "gpt-5.6-sol (codex)",
  "status": "reviewed"
}
