{
  "alignment_sha256": "f610bf304bb61f14adf8f094ce0fcb89b3308b24a543373558832025e08c2869",
  "contract_version": "ot-hebrew-verse-v51",
  "notes": [
    "Independent review by gpt-5.6-sol (codex) — corrected"
  ],
  "ref": "ISA.30.31",
  "reviewed_by": "gpt-5.6-sol (codex)",
  "status": "reviewed"
}
