{
  "alignment_sha256": "e285019380a718e1971ce09f1efbd5604db4c25d365ba860c062cc965ad21edf",
  "contract_version": "ot-hebrew-verse-v46",
  "notes": [
    "Independent review by gpt-5.6-sol (codex) — unchanged",
    "Recorded head-only corrections from headword-candidates were applied on 2026-09-08T14:32:02.534003+00:00. Prior full-review coverage is carried forward for unchanged content; only the approved head delta and associated note explanations changed. Original review and alignment hash 50e385d2b81f8bd711d8d56c4392a60822da6a6f690bab45501aba8897a0b3d9 are archived under data/audits/headword-candidates/before-application/. Strong-model pattern-assessment and application evidence: data/audits/headword-candidates/applications/ISA.52.12.json. No new full-verse review is claimed."
  ],
  "ref": "ISA.52.12",
  "reviewed_by": "gpt-5.6-sol (codex)",
  "status": "reviewed"
}
