{
  "alignment_sha256": "272092394627d9c666d17078c12264200a355aaa637c2340242da58bddd9910a",
  "contract_version": "nt-greek-verse-v74",
  "notes": [
    "Independent review by claude-code — unchanged",
    "ταῖς is unrepresented, the attributive demonstrative ἐκείναις occupying the determiner slot (rule 38).",
    "The supplied complementizer *that* goes to the expanded non-finite complement, and *fell sick* heads on *sick* (rules 85 and 17).",
    "ὑπερῴῳ → *an upper chamber* headed on *chamber*, the noun glossing the substantive as `ζῷον` → *living creature* does (rule 66)."
  ],
  "ref": "ACT.9.37",
  "reviewed_by": "claude-code",
  "status": "reviewed"
}
