{
  "alignment_sha256": "ff1e11c2ca6507e40ce484bdb1cd4180554d3fab4320cfa9bb45ddad021269fe",
  "contract_version": "nt-greek-verse-v115",
  "notes": [
    "Independent review by claude-code — unchanged",
    "ἴδιος standing attributively between article and expressed noun carries the supplied possessive under rule 47, so τῆς is unrepresented under rule 20.",
    "The ASV's marginal *superstition* does not change the alignment of δεισιδαιμονίας."
  ],
  "ref": "ACT.25.19",
  "reviewed_by": "claude-code",
  "status": "reviewed"
}
