{
  "alignment_sha256": "1112e59a4c2c3ea6a37ae8d1961329b7efe8a93b74c7dc6a809b005a1280ec3f",
  "contract_version": "ot-hebrew-verse-v47",
  "notes": [
    "Independent review by gpt-5.6-sol (codex) — corrected"
  ],
  "ref": "EZK.20.22",
  "reviewed_by": "gpt-5.6-sol (codex)",
  "status": "reviewed"
}
