{
  "alignment_sha256": "99115e68cfcb656ea4a49b90853aadbfde7b80a203ec11a37481ee54e22c85c8",
  "contract_version": "ot-hebrew-verse-v173",
  "notes": [
    "Targeted retrospective REVISE: retain cheese lexical fusion excluding article; restore article s012 to their under rule 41; keep look separate but fuse welfare phrase s019-s020 to how ... fare, headed s020/t017. Unrelated units retain prior review."
  ],
  "ref": "1SA.17.18",
  "reviewed_by": "gpt-6-astra (codex; high)",
  "status": "reviewed"
}
