{
  "alignment_sha256": "e785772f7ebc25d86629afb63ce1465b56aa684c19b8a66aff5631acb4bc608d",
  "contract_version": "ot-hebrew-verse-v170",
  "notes": [
    "Independent review by claude-code — unchanged",
    "whether is the interrogative particle's, so the fronted will stays with the participial predicate (rule 17).",
    "The it of did keep it is marked added, since the Hebrew clause writes no object morpheme (rule 44).",
    "bam fuses to therein headed on the preposition, no relative standing in the clause (rule 22)."
  ],
  "ref": "JDG.2.22",
  "reviewed_by": "claude-code",
  "status": "reviewed"
}
