{
  "alignment_sha256": "ac5f0ef67bacd2c9cff52cdf442b490bc41eee099eabae543161223e0bd11938",
  "contract_version": "ot-hebrew-verse-v17",
  "notes": [
    "Independent review by claude-code — unchanged",
    "Each בְּנוֹ is split into noun and suffix with the crossing 'his son' order handled by rule 25; the pattern recurs in vv.21-24, 26-27, 29-30."
  ],
  "ref": "1CH.6.20",
  "reviewed_by": "claude-code",
  "status": "reviewed"
}
