{
  "alignment_sha256": "c63616cc899d2f90a96af76f014891f8970b5e073ab6d666bf7c9b41c8c2ecda",
  "contract_version": "ot-hebrew-verse-v124",
  "notes": [
    "Independent review by claude-code — unchanged",
    "me-ever fuses as beyond (rule 30), leaving the following lamed unrepresented; the second directive he takes a word of its own (toward) while the first is fused into eastward."
  ],
  "ref": "NUM.34.15",
  "reviewed_by": "claude-code",
  "status": "reviewed"
}
