{
  "alignment_sha256": "14f7869cb684849fa41c4b6d01abd75e04341eca61b42067612c86d8c6b02557",
  "contract_version": "ot-hebrew-verse-v3",
  "notes": [
    "Checked partition, construct-chain of/the placement (hands/captains/guard, door/king's house), article-before-participle as who, tachtam split, and supplied them on hiphil paqad; no change."
  ],
  "ref": "1KI.14.27",
  "status": "reviewed"
}
