{
  "alignment_sha256": "cac13a77d6d935e7b66d71845adc51db4b6f0a2662c1bb5c6c1cfdc9e273793a",
  "contract_version": "ot-hebrew-verse-v182",
  "notes": [
    "Independent review by claude-code — unchanged",
    "The division of *chasteneth him betimes* between שָׁחַר and מוּסָר is the one materially contested choice: the ASV spends *betimes* on the verb's early-seeking sense and *chasteneth* on the noun of discipline. Taking *chasteneth betimes* whole for שָׁחַר and marking מוּסָר unrepresented was the competing reading, and it would leave a lexical noun holding no English against rule 2."
  ],
  "ref": "PRO.13.24",
  "reviewed_by": "claude-code",
  "status": "reviewed"
}
