{
  "alignment_sha256": "bb92075e27f227d0c992d0f8031bf43bbc88112009ca1e42dccd44c0e3a71a27",
  "contract_version": "ot-hebrew-verse-v48",
  "notes": [
    "Independent review by gpt-5.6-sol (codex) — unchanged"
  ],
  "ref": "GEN.48.1",
  "reviewed_by": "gpt-5.6-sol (codex)",
  "status": "reviewed"
}
