{
  "alignment_sha256": "9b1cef0cfe7edefe6655984c88bc83f3df4cb8f5e468ab5b1ef996c1a7a045d5",
  "contract_version": "ot-hebrew-verse-v217",
  "notes": [
    "Independent review by claude-code — unchanged",
    "Hiphil tashqeh rendered given ... to drink, head on drink (rule 44); the to before the weary reaches the second bare object of the double-accusative verb and stays with the verb."
  ],
  "ref": "JOB.22.7",
  "reviewed_by": "claude-code",
  "status": "reviewed"
}
