{
  "alignment_sha256": "427b992a9f477c99d6f4c22ff0b94a6da7abb115d68b7fbc666752d0cbb553d2",
  "contract_version": "nt-greek-verse-v102",
  "notes": [
    "Independent review by claude-code — unchanged",
    "The frame in the days of kept whole on ἐπί under rule 67 and headed on the prepositional word; the EPH/PHP line would head it on days, and rule 67 leaves that division open for a proper preposition.",
    "The juncture and given to ἐσήμανεν, the finite verb it introduces after the participle ἀναστάς was converted to a coordinate clause (rules 29 and 88)."
  ],
  "ref": "ACT.11.28",
  "reviewed_by": "claude-code",
  "status": "reviewed"
}
