{
  "alignment_sha256": "8e5f28ac6b8a99decf174038632d817f42310474c42509fc481363597ec665b9",
  "contract_version": "ot-hebrew-verse-v59",
  "notes": [
    "Independent review by gpt-5.6-sol (codex) — corrected"
  ],
  "ref": "JOS.21.20",
  "reviewed_by": "gpt-5.6-sol (codex)",
  "status": "reviewed"
}
