{
  "alignment_sha256": "afa9d521aa6c9be6bbc89cc6686b9130392b2e3cdce50532f1c407118bad799e",
  "contract_version": "ot-hebrew-verse-v218",
  "notes": [
    "Independent review by claude-code — unchanged",
    "עַל אֲשֶׁר → Because and עַל־כֵּן → therefore each fuse headed on the governing preposition (rules 30, 23); 'brought ... forth' keeps the particle with the hiphil (rule 44)."
  ],
  "ref": "2CH.7.22",
  "reviewed_by": "claude-code",
  "status": "reviewed"
}
