{
  "alignment_sha256": "80ca5378ba472338aed52b9263104eeaeb1dfe18facb03ebbaa814a1541f0aea",
  "contract_version": "ot-hebrew-verse-v46",
  "notes": [
    "Independent review by gpt-5.6-sol (codex) — corrected"
  ],
  "ref": "GEN.43.21",
  "reviewed_by": "gpt-5.6-sol (codex)",
  "status": "reviewed"
}
