{
  "alignment_sha256": "1dc087ca2f91e4e68eb904135e7ef60a2ce7f20977397e69c3d0d557abd92055",
  "contract_version": "nt-greek-verse-v70",
  "notes": [
    "Independent review by claude-code — unchanged",
    "αὕτη takes the supplied copula itself under rule 68, being a substantival demonstrative subject.",
    "οὐκ keeps *none* because ἄλλη is no negative indefinite."
  ],
  "ref": "MRK.12.31",
  "reviewed_by": "claude-code",
  "status": "reviewed"
}
